{
  "schemaVersion": 1,
  "capturedAt": "2026-09-06T00:00:00.000Z",
  "evidenceKind": "fixture",
  "platform": {
    "os": "linux",
    "osVersion": { "value": "Ubuntu fixture", "source": "fixture", "timestamp": "2026-09-06T00:00:00.000Z", "confidence": "high", "unknownReason": null },
    "arch": "x86_64",
    "abi": { "value": "x86_64", "source": "fixture", "timestamp": "2026-09-06T00:00:00.000Z", "confidence": "high", "unknownReason": null },
    "containerOrVm": { "value": false, "source": "fixture", "timestamp": "2026-09-06T00:00:00.000Z", "confidence": "high", "unknownReason": null }
  },
  "cpu": {
    "name": { "value": "Single Core Fixture", "source": "fixture", "timestamp": "2026-09-06T00:00:00.000Z", "confidence": "high", "unknownReason": null },
    "logical": { "value": 1, "source": "fixture", "timestamp": "2026-09-06T00:00:00.000Z", "confidence": "high", "unknownReason": null },
    "physical": { "value": 1, "source": "fixture", "timestamp": "2026-09-06T00:00:00.000Z", "confidence": "high", "unknownReason": null },
    "allowed": { "value": 1, "source": "fixture", "timestamp": "2026-09-06T00:00:00.000Z", "confidence": "high", "unknownReason": null },
    "smt": { "value": false, "source": "fixture", "timestamp": "2026-09-06T00:00:00.000Z", "confidence": "high", "unknownReason": null },
    "heterogeneous": { "value": false, "source": "fixture", "timestamp": "2026-09-06T00:00:00.000Z", "confidence": "high", "unknownReason": null },
    "coreGroups": { "value": [{ "kind": "unknown", "logicalIds": [0], "label": "core0" }], "source": "fixture", "timestamp": "2026-09-06T00:00:00.000Z", "confidence": "high", "unknownReason": null },
    "cache": {
      "l2Bytes": { "value": null, "source": "fixture", "timestamp": "2026-09-06T00:00:00.000Z", "confidence": "unknown", "unknownReason": "not-probed" },
      "l3Bytes": { "value": null, "source": "fixture", "timestamp": "2026-09-06T00:00:00.000Z", "confidence": "unknown", "unknownReason": "not-probed" }
    },
    "numaNodes": { "value": 1, "source": "fixture", "timestamp": "2026-09-06T00:00:00.000Z", "confidence": "medium", "unknownReason": null }
  },
  "memory": {
    "totalBytes": { "value": 2147483648, "source": "fixture", "timestamp": "2026-09-06T00:00:00.000Z", "confidence": "high", "unknownReason": null },
    "availableBytes": { "value": 1073741824, "source": "fixture", "timestamp": "2026-09-06T00:00:00.000Z", "confidence": "high", "unknownReason": null },
    "processLimitBytes": { "value": null, "source": "fixture", "timestamp": "2026-09-06T00:00:00.000Z", "confidence": "unknown", "unknownReason": "no-cgroup-limit" }
  },
  "power": {
    "onAc": { "value": true, "source": "fixture", "timestamp": "2026-09-06T00:00:00.000Z", "confidence": "high", "unknownReason": null },
    "batteryPresent": { "value": false, "source": "fixture", "timestamp": "2026-09-06T00:00:00.000Z", "confidence": "high", "unknownReason": null }
  },
  "sensors": {
    "thermalReadable": { "value": false, "source": "fixture", "timestamp": "2026-09-06T00:00:00.000Z", "confidence": "high", "unknownReason": null },
    "powerReadable": { "value": false, "source": "fixture", "timestamp": "2026-09-06T00:00:00.000Z", "confidence": "high", "unknownReason": null }
  },
  "engine": {
    "abiSupported": { "value": true, "source": "fixture", "timestamp": "2026-09-06T00:00:00.000Z", "confidence": "high", "unknownReason": null },
    "flags": []
  },
  "invalidationHints": ["hotplug", "power-source-change"]
}
