{
  "schemaVersion": 1,
  "capturedAt": "2026-09-06T00:00:00.000Z",
  "evidenceKind": "fixture",
  "platform": {
    "os": "windows",
    "osVersion": { "value": "Windows fixture", "source": "fixture", "timestamp": "2026-09-06T00:00:00.000Z", "confidence": "high", "unknownReason": null },
    "arch": "x86_64",
    "abi": { "value": "x86_64", "source": "fixture", "timestamp": "2026-09-06T00:00:00.000Z", "confidence": "high", "unknownReason": null },
    "containerOrVm": { "value": false, "source": "fixture", "timestamp": "2026-09-06T00:00:00.000Z", "confidence": "high", "unknownReason": null }
  },
  "cpu": {
    "name": { "value": "SMT Fixture CPU", "source": "fixture", "timestamp": "2026-09-06T00:00:00.000Z", "confidence": "high", "unknownReason": null },
    "logical": { "value": 16, "source": "fixture", "timestamp": "2026-09-06T00:00:00.000Z", "confidence": "high", "unknownReason": null },
    "physical": { "value": 8, "source": "fixture", "timestamp": "2026-09-06T00:00:00.000Z", "confidence": "high", "unknownReason": null },
    "allowed": { "value": 16, "source": "fixture", "timestamp": "2026-09-06T00:00:00.000Z", "confidence": "high", "unknownReason": null },
    "smt": { "value": true, "source": "fixture", "timestamp": "2026-09-06T00:00:00.000Z", "confidence": "high", "unknownReason": null },
    "heterogeneous": { "value": false, "source": "fixture", "timestamp": "2026-09-06T00:00:00.000Z", "confidence": "high", "unknownReason": null },
    "coreGroups": { "value": null, "source": "fixture", "timestamp": "2026-09-06T00:00:00.000Z", "confidence": "unknown", "unknownReason": "groups-not-modeled" },
    "cache": {
      "l2Bytes": { "value": 4194304, "source": "fixture", "timestamp": "2026-09-06T00:00:00.000Z", "confidence": "medium", "unknownReason": null },
      "l3Bytes": { "value": 16777216, "source": "fixture", "timestamp": "2026-09-06T00:00:00.000Z", "confidence": "medium", "unknownReason": null }
    },
    "numaNodes": { "value": 1, "source": "fixture", "timestamp": "2026-09-06T00:00:00.000Z", "confidence": "medium", "unknownReason": null }
  },
  "memory": {
    "totalBytes": { "value": 34359738368, "source": "fixture", "timestamp": "2026-09-06T00:00:00.000Z", "confidence": "high", "unknownReason": null },
    "availableBytes": { "value": 17179869184, "source": "fixture", "timestamp": "2026-09-06T00:00:00.000Z", "confidence": "high", "unknownReason": null },
    "processLimitBytes": { "value": null, "source": "fixture", "timestamp": "2026-09-06T00:00:00.000Z", "confidence": "unknown", "unknownReason": "no-job-object-limit" }
  },
  "power": {
    "onAc": { "value": true, "source": "fixture", "timestamp": "2026-09-06T00:00:00.000Z", "confidence": "high", "unknownReason": null },
    "batteryPresent": { "value": false, "source": "fixture", "timestamp": "2026-09-06T00:00:00.000Z", "confidence": "high", "unknownReason": null }
  },
  "sensors": {
    "thermalReadable": { "value": false, "source": "fixture", "timestamp": "2026-09-06T00:00:00.000Z", "confidence": "medium", "unknownReason": null },
    "powerReadable": { "value": false, "source": "fixture", "timestamp": "2026-09-06T00:00:00.000Z", "confidence": "medium", "unknownReason": null }
  },
  "engine": {
    "abiSupported": { "value": true, "source": "fixture", "timestamp": "2026-09-06T00:00:00.000Z", "confidence": "high", "unknownReason": null },
    "flags": ["smt"]
  },
  "invalidationHints": ["hotplug", "power-source-change", "thermal-throttle"]
}
